{
  "schema_version": "1.0",
  "attestation_id": "att_1a2b3c4d5e6f7890",
  "device_id": "dev_9e9c644e1580a83b",
  "proof": {
    "device_id": "dev_9e9c644e1580a83b",
    "nonce": "abc12345xyz",
    "timestamp": "2026-07-25T19:00:00Z",
    "algo": "mock",
    "payload": {
      "max_power_kw": 2.5
    },
    "signature": "deadbeefdeadbeefdeadbeefdeadbeefdeadbeefdeadbeefdeadbeefdeadbeef"
  },
  "decision": {
    "allowed": true,
    "reason": "mock-allowed",
    "max_power_kw": 2.5
  },
  "oracle_id": "oracle_main_1",
  "issued_at": "2026-07-25T19:05:00Z",
  "oracle_signature": "cafebabecafebabecafebabecafebabecafebabecafebabecafebabecafebabe"
}
